{
  "schema_version": "1.0",
  "source_sha256": "58cdf8f8aae51f41daf1b2e48b96131731893559a508bfeb7354f9cb3c0c01ad",
  "base_model_sha256": "3a16b17f808ae4d33777546a6bca2c74f1de4ce7ea8ac79b96d167f4546fc0cf",
  "lens_contract_version": "1.0",
  "prompt_version": "1.0",
  "artifacts": {
    "open_reading_model": "model/open_reading_model.json"
  },
  "created_at": "2026-09-26T15:49:51.615576+00:00"
}
